text;label
"самая счастливая мамочка; всем здоровья!!";0
который уходит от ответственности давно пора запереть!;0
извините, про какого масло идёт речь?;0
мотор запасной цену можно, состояние?;0
молодец это мы забыли а раньше наши бабушки и прабабушки сами приданное готовили ткали кружева вязали расшивали рубахи рушняки настоящия рукодельница савет да любовь;0
здравствуйте, хочу заказать черепашка ниндзя гродненская обл г слоним ул циолковского25 а индекс 231893;0
почему одинокому мужчину, если муж и жена?;0
спарк можно бы прикупить, очень зарекомендовал себя, по цене и комплектации, надежности.;0
на капитальный гараж можно с моей доплатой.;0
название фильма совсем другое,нежели заявлено!!;0
2 беременности спасалась от вирусов прополисом, перед выходом из дома жевала, все ок.;0
чистый мужской голос который врезается в уши тяжелый но приятный класс!;0
когда ломают ветки, или того хуже, рубят дерево - стресс!!;0
пригодится разработчики периодически просят собирать его в квестах;0
просим посетить группу все обо всем ссылки вышлю в сообщение;0
они рулят россией с 1917 г. а вы и не заметили или не знали илине хотите знать.;0
мой дед сапронов александр васильевич 1897 гр участник 3 х войн: с германией, призван совсем молодым.;0
дай бог здоровья вам ребята из вас выросту настоящие мужчины.;0
всех телят по деревни собрали, такого не может быть, двоих не больше.;0
не важно на кого похож ребёнок главное жив здоров желанный смотрит улыбаясь обнимая маленькими ручками ведь это счастье;0
от всей души поздравляю ярослава сумишевского!;0
какая конспитуция еще вообще в курсе вы законы что у воров свои;0
не пойму что случилось,играла с нормальной скоростью,был небольшой перерыв и когда продолжила игру скорость пропала,все еле двигается терпения нет,кто знает в чем дело и что делать?;0
при таком способе чувствительность сигнализатора значительно падает!!;0
всегда крепил маленькое колечко на тюльпан , а через большое -пропускал леску.;0
поклевку хорошо видно даже при ветре(сторож колеблется вправо-влево, при поклевке - вверх-вниз);0
галина, вы меня простите и понимаете о чем я говорю.;0
бабуля на фото глянь это ты в молодости или уже если что надо скорую в дурку;0
мороженое купила за монетки, теперь нужно ожерелье.;0
ушедшие в мир иной запечатлены и.е.репиным на века.;0
везде аферисты -- хоть бога бы побоялись ведь можете потом и правда пропавшего искать.;0
мне фильм вообще не интересно хотел смотреть на вас троих 😉;0
аминь великий советский артист театра и кино.;0
реунова валентина ивановна, - председатель президиума верховного совета ссср.;0
ягоду, что-то полезное для дома, быт.химию, верх.одежду 44-46 и др.предложения тоже рассмотрю);0
хороший сюрприз😁👍❤ теперь пёсик будет обожать арбузики😁👍🥰;0
все будет хорошо потому что плохо надоело уже да зарасти оно все чб ромашкамиц одобрым утром с;0
дай бог тебе и твоей семье всех благ !;0
фильтр 6ти ступенчатой очистки.с насосом.15 тр.торг;0
но если твой дом всегда шумел, если играли и бегали дети, были тут и родители, и муж.;0
а ты осталась одна в деревенской избе или квартире.;0
рядом никого, кто раньше был так дорог, о ком заботилась.;0
помогали ей, гуляли, напивались парного молока.;0
теперь они с родителями едут на юг,за границу, только не к той с которой все начилось.;0
уважаемые,кто не доволен своим бюджетом...вам не кажется,что в этом не ляйсан виновата?;0
поздравляю вас с днем рождением жилаю вам крепкого здоровья долгих лет жизни и всех земных благ;0
прям я весной хочу влезть во что-то прошлогоднее.;0
а во втором ряду, вторая слева моя мама;0
я скоро наверное так же буду выглядеть, с 5 детьми, на карантине;0
когда дети рождаются им делают прививки чтоб они не болели ,той или иной болезнью.;0
дети с младенчества должны слышать доброе о своих дедушках и бабушках.;0
они должны видеть дела своих родителей по отношению к дедушкам и бабушкам.;0
дети с младенчества впитывают как губка,тон голоса и поступки своих родителей.;0
к великому сожалению на детей очень влияет и то что они смотрят по телевизору ... даже есть мультфильмы которые не приносят пользу ребенку а вред.;0
всем крепкого здоровья сладкого дня хорошего настроения больше позитива радости и счастья;0
верните водник - чемпион, трамваи, шхуну запад, деревянные мостовые - вот это визитки города.;0
я слышала в струнино делают.. но не знаю точно.;0
по сбору стоп 9.08. по всем вопросам в личку!;0
он разрезан пополам, чтобы видно было , что внутри, и как выглядит на разрезе.;0
всем большое спасибо за теплые слова😌 игра продолжается до понедельника🌸;0
с вилки такого маленького ребенка не кормят, мамочка!;0
вкус каймака да еще со свежей лепешкой!это незабываемо!;0
я указываю ифо и место проживания только в электросетях,когда оплачиваю за свет.;0
а про дедовический район вообще знают,что он есть?;0
у всех своя история , я написал свою мнению , у всех это по разному получается , надо любить с головой .;0
я давала кальция глицерофосфат в пойло и колола элеовит я новичок но моей помогло;0
отдам-- весы, шитый кошелёк ,аромат.свечи ,зел.полотенце;0
добрый день, дочь в пятницу приезжала, брала с собой кучу документов, подтверждающих, что жила раньше в горловке и едет к маме, все показывала и ее пропустили;0
можете пожалуйста позвонить по этому номеру 89066622872, когда груши вновь будут в продаже.;0
какие нужны документы что бы усыновить ребенка;0
ирина владимировна мы так и останемся воображать из себя деловых!;0
но дойдёт момент, когда я выставлю, диктафонную запись, как в сельсовете пилят уголь!!;0
реэлторов у нас нет, а если хотите купить квартиру, просто пишите объявление о покупке.;0
ольга, не уверена, что я всё правильно сделала, поэтому страхуюсь.;0
вакцинироваться или нет, это ваше дело, что вы так остро всё воспринимаете.;0
это всего лишь информация и всё,далее поступайте как знаете.;0
из-за таких советов я чуть ребенка не потеряла.;0
дочке было два месяца, когда у нее начался понос.;0
теперь, когда думаю об этом, волосы дыбом становятся.;0
ребенку в два месяца правильную смесь детскую не так просто выбрать, а тут такое.;0
ещё хорошо, что вовремя успели скорую вызвать.;0
иначе не было бы у меня сейчас дочки.;0
спасибо за видео,хотелось бы узнать и финансовую сторону такой квартиры и переезда.;0
видела ее лично на съемках фильма самая обаятельная и привлекательная осталось незабываемое впечатление браво !;0
некоторые депутаты,опасаясь,что народ против единой россии,решили поменять партию,чтоб пролезть в депутаты...;0
когда встреча в талимарджане?всем привет талимарджанцам.;0
какой умный пёс.обожаю собак , ведь они самые верные.;0
кто-то знает,будут ли выплачивать какую то помощь на август?;0
где найти склад игрушек на союзной полянке?;0
линдау - очень красивый и уютный курортный городок на острове, расположенный на границе трех стран: германии, швейцарии и австрии.;0
здесь очень много отдыхающих, но как-то тихо и спокойно.;0
море цветов и зелени и самые красивые виды, открывающиеся на боденское озеро.;0
почему же, наоборот, очень даже мило.;0
на свитерочках тоже будет очень кстати;0
было у меня такое, на 240 р. хорошо я от кассы далеко не отошла... купила одни очки, а пробили двое.;0
не уверена что он ничего не знает что происходит, - вопрос- зачем и что дальше???;0
так значит это вы проложили дорогу от корейки , до тюратама , я по ней ездил за вином !;0
светлая память всем тем кто войны с не вернул кто частичкой стал тишины кто лег проснухся в горах и не необъявленной от войны;0
господи , сохрани , только в ссср не отправляй я уже там была 40 лет.;0
ну, и мы чуток побегали) призы порадовали, как всегда, ресурсов подкопили) спасибо разработчикам!;0
доброту нужно снимать а не издевательство над котом, не подавился хозяин где твое сердце?;0
это на утро после встречи с друзьями , когда себя в зеркале увидел...;0
я ловлю, но отпускаю, беру только трофейную;0
на шею себе оденьте эти белые ленточки... и затягивайте потихоньку...;0
а то все продлевают и продлевают режим повышенной готовности может я что то пропустил.;0
дело в том, что в данном-то случае папа совсем не в ответе за детей...;0
ну конечно фейковые картинки это прям новости века;0
обязательно обильное питьё... а лучше клюквенный морс;0
ошибка известно животные очень красивая;0
с днем рождения дружище виктор-живи долго и счастливо -сегодня твой день и мы будем говорить то что ты заслужил в жизни-а это только добрые пожелания.;0
показан ряд икон, которым более тысячи лет, на которых изображен фрагмент сан питера.;0
а в каком году якобы петром 1 построен петербург ?;0
соболезную.вечная память.пусть земля будет пухом.;0
больной начал что то подозревать, когда врач при нём начал мерить его ботинки;0
видимо они сами ее отсыпали и в свое время собирали на это деньги , но как всегда никто не захотел скинуться , а машину ставить хотят все;0
"2ряд, 4 с верха; 5 ряд,2 с верха; 7 ряд, 5 с верха.";0
светлана желаю тебе занять всё таки первое место!;0
не троньте вы вообще эти дискотеки, парни не нуждаются в ваших сравнениях.;0
напишите просто - парни красавы, берите с них пример!;0
есть проблема, когда долго работает пропадает звук, выкл и вкл работает опять, сумма ремонта составит 25 руб.;0
может у кого есть сектора на примете с дефом.;0
а медведка в высушеном виде поможет вылечить туберкулез;0
это часы моего детства... когда ходили на пляж на левбердон с родителями)));0
чай и кофе разобрали и передали, следите за вашими цр!;0
у организатора можно забирать по адресу шатило, 20, предварительно нужно звонить 89283039046;0
нельзя их допускать к себе и к своим близким, если мы откажемся от всего-то что связаны с их ними планами то они проиграют и обламаются!;0
слова должны поддерживаться делом и все встает на свои места!;0
а какая разница,вы думаете в россии такого нет?;0
хотите все нормально что бы было надо платить;0
только в природе голубых лилий нет!это фотошоп;0
запас на таких боссов нужен все равно!;0
грамотная любовь, как оказалось, вас как раз учить русскому и надо.;0
а у русских алфавит тоже пришлый, как и у многих народов.;0
всё вот это выслушиваешь-читаешь, конечно это всё правильно, задевает душу простого народа, а в итоге всё как было.;0
всё так остаётся и сдвинуть эту не справедливость в нашей жизни нам не под силу.;0
наша молодость , без телефонов и интернета, она была прекрасна;0
👍👍мне как раз нужен такой , схема есть ?;0
продам шикарный дом (несколько вариантов (озерная, коммунистическая, степная улица, апрельская).;0
8951-616-8162. документы в порядке, рассматриваем все варианты продаж.;0
применительно к нынешнему времени можно было бы сказать: жертвы реновации;0
без масок люди были бы людьми,а так это только театр;0
муж оставил вас, но бог никогда не оставить вас, только довертесь ему, всем сердцем.;0
вновь избравшись,он проявит вселенскую милость,отпустив наших ребят,думаю не безкорыстно.;0
вдв если бьют, то уже мало кто сможет пожаловаться после.;0
тут и дикий кабан,и медведи и рыбы и белоголовый орлан 5 птиц!;0
добрых тебе ручек ,хорошей семьи !;0
ведь именно они набрали зашкаливающий процент за.;0
они в районе города частные что ли, что их нам же и надо передавать?;0
это были хорошие времена.скорее это помощ совхозам и колхозам.дедь все взрослые были заняты уборкой на полях.да и вреда нет в этом.труд есть труд она сплачивала.это учила к коллективизаци.;0
подскажите, можно как-то вызвать вредителей?;0
очень красиво и необычно,девочка большая молодчинка:) 👍;0
а чего ж папа цепкало с детьми сразу рванул в россию?;0
надо будет как нибудь попробовать так сделать ))) спасибо за идею 😘😘😘;0
а вообще обычно по каким числам приходят такие пособия, скажите пожалуйста?;0
предложение сделать коллекции, например, цветы очага или магии, а награды шустрика и супер-веник.;0
без них нечего уже в игре делать, а покупать скорость в игре игроки не должны вообще-то.;0
скажите ,а автобус с антрацита до москвы прямой или только до таможни ?;0
дзен упражнение: найдите в сети человека,который сильно заблуждается.;0
соберите свою волю в кулак и...ничего ему не отвечайте.;0
так там впереди по лестнице кто-то шёл, неужели не помогли;0
ну не оставлять же на произвол судьбы, беспомощных родителей.;0
у моей соседки две дочери, так вот они поочереди приезжали и жили с матерью до конца её жизни.;0
варианты можно найти, было б желание.;0
наталья николаевна сидит в доме быта.;0
доставки нет сейчас уже продали я могу написать когда будет;0
доброй ночи) а есть карта фестивального острова?;0
беретка, это у женщин.у нас берет.а берутся они от водки.и не важно что у них на голове и в какую сторону полоска;0
к нему не зарастет народная тропа, вознесся выше он главою непокорной александрийского столпа;0
не кому не нужные галоши то же шли на экспорт за бугор;0
тебе дарована возможность слышать музыку и видеть улыбку любимого человека.;0
у тебя есть все что бы любить и дарить любовь.;0
ты есть жизнь и ты можешь дарить жизнь.;0
написала и выставила а рецепта нет кабачков ой икры.;0
очень нравится борис корчевников,думаю у него большая и добрая душа,верю ему желаю здоровья и счастья.просто мой любимчик.;0
желаем успешного творчества и новых идей .;0
а как иначе, сам себя не похвалиш никто не похвалит,так и сбербанк себя сам нахваливает;0
нужны инструменты меняю на зерно или лилии 1к 15;0
меня интересует цена вот таких ворот и балкон.;0
в аптеке здравствуйте можно мне корвалол новопассит валерьянку глицин мелаксен и у хорошо вас все да пришел аванс;0
анна, согласна, обучение свелось к загрузке детей заданиями, а кто будет объяснять, никого не волнует.;0
делайте!родители всего знать не могут, у нас нет педагогического образования.;0
в советские времена электропоезд их минеральных вод до кисловодска ходил 1 час;0
не, второй раз в одну и ту же игру я точно играть не стану.;0
на буковине, председатель сельсовета , пацан и 30 нет, из поселка сделал конфетку.;0
такой вещи простой в хозяйстве не оказалось!;0
факты предоставте.балясины вообще не интересуют ,а проблема с водообеспечением города - вот что на1 месте ,а с этой прблемой - глухо ,лечше бордюрчики и плиточку ( смываемою);0
аллилуйя аминь слава и хвала тебе бог обильных благословений вам всем;0
вам всем счастья, детишкам большое, крепкое здоровье, родителям -терпенья огромного здоровья;0
да, были люди в наше время - могучее, лихое племя!;0
раз тебе надоел сын отдай лучше добрым людям.;0
справа это сараи 75гг пелагея вот что-то делает я иду в дом кто ещё не помню;0
добрый вечер , в какую цену куртка ?;0
я знал этого исполнителя очень давно и слушаю его песни💝;0
радоваться ведь тоже не всякий может !;0
друзья мои верные, выручайте в трудном деле!;0
