text;label
ты нацис йибаней как можно паднять руку на женщин если кто небут тваю сестру или мать так избалбы как таких пидаразев земля носет;0
передайте этим хозяевам , что они мрази, пожалуйста...;1
суки пиздят за неделю всё разволилось;0
я бы этим блядям не только в жопе засунул;0
зажравшиеся свиньи не пора ли вам в хлев;0
платошкин н н в отличии от этого урода настоящий грамотный и прекрасный человек,а это чмо ,но я думаю скоро будет вертеться на своей поганой заднице.как земля таких уродов носит.;1
ваш кисляк разбавить... а ебанько это ты меня назвала?;0
а у скотских ,наглых, ублюдочных буржуев будущего нет , хотя ,вру, есть,но я им не завидую!;1
а что хуторская что на хуй не кому не нужна;0
корм и ведь,с.ки,не подавятся!!;1
.... ...сказочный долбоёб.....(md) (md) (md);0
сильный лидер не врет, сильный лидер не пидр, сказал сделал, а вова , врал, врет и будет врать, чтоб у власти устоять.;1
какая падла снимала гибель косули, нет бы помочь;1
таких пидорасок гнать в шею живут засчет пинсионеров;0
а механика для долбоёбов ....... можно тогда и на дровах ездить и угля добавить .;0
вы вообще в себе ,что тварью обзываете человека ?;1
гавно у тебя в башке, умник.;1
это не десантники---- это быдлы,,,;1
ты такое же дерьмо - как и твои оппоненты !;0
пусть попробуют заработать, а не в инете чужие деньги считать уебаны бля;1
вот читаю вашу перепалку,и думаю,а на куя вам этот дебил нужен,чтобы с ним общаться,;1
почему эту тварь оправдывают?он сидел за рулем в гавно обдолбанный.если бы аварию допустил обыкновеннный человек.то засудили бы сразу.а кто такой ефремов?;0
мрази пиндосовские, пусть с... т👎👎👎👎👎;1
ну что поделаешь, пидоров везде хватает.;1
дэбилы,а хули вы можете только пиздеть;1
нормальные мужчины туда работать не идут идут неудачники и пидоры.;0
твой рубль сейчас и говна не стоит.;0
и ты тоже нихуя не стоишь.;0
засуетились , пиндосы...... чувствуют задница подгорает, теперь советоваться будут, координировать....;1
ето не пацан а выродок котррый готов убивать людей детей;0
вот уроды самих бы кто на улицу выкинул с детьми;0
один х...й пидар....сня;0
очередная мразь сделала гадость - и на душе радость !;0
когда вы долбоёбы упоротые уже угомонитесь ?;0
этот ублюдок еськов сказал по матчу тв, что я не мог отменить пеналь, потому что это было бы нарушение регламента вар.... ну не пидор!!!!;1
когдть же этот уёбок пойдёт гулять по мосту.;0
блядь, намешали все в одну кучу, и белок и антибиотик и фенолы всякие.;1
пиздабольство это всё,у там родные живут;1
вообще то, блядь, вором можно человека назвать только по решению справедливого суда.;1
сабаки спасатели наверное должны уметь раскапывать да по нюху орентироваться а не по веревкам лазить, идиоты разве так можно издеваться!!;1
только этих придурков ещё не хватает!;0
что за ебанутый смех!сразу видно, деревенщина,😞;1
вот сволочь!да чтоб ему аукнулся этот благородный поступок!;0
мужик красава👍 👍 👍 что бы не повадно было всяким шкурам ставить свои корыта где попало;0
что блха-муха не нашлось мужика прихлопнуть эту суку.;0
фнуресои отдельный привет хочется передать тем кто жил с я девизом вне политики чтоб ребят вы понимали весь творящийся россии в пиздец долбоебов именно из за таких как вы;0
конечно не пролестает 7 лет жизни это уёбище забрало;0
урод, падла на человека не похож ,мразь ебаная...;1
забудте пидоры голубой цвет не ваш,ваш цвет коричневый.;1
ты пидор гнойный даже колхоз свой не можешь настроить, уебок.;1
сука ефремов ты оказывается тварь а я как актера тебя и твоего батю уважал а теперь падла пускай тебя бог судит;0
что ментов пидорасов жалко, ну и пусть ломают вас дальше, а менты пидорасы когда празднуют себя хорошо видут, суки они;1
причём поганой ссука метлой её гнать из страны.. пи...............ина.ссука.;0
точно!они или читать не умеют или моральные уроды;0
если либералы, пидоры его оправдывают-значит дерьмо!;1
евраз пидорасы показуха да и только в книгу рекордов гинеса не попали нет;0
три дебила ещё не весь десант двух слов связать не могут;0
слышь дырявый, самоутверждаешься изливая понос нажимая кнопочки?;1
не вижу смысла тут переписываться с тупорылкой, в реале бы поговорил.;1
только такое хуйло как ты постоянно съезжает;0
придурок твой тютчев.воткни в очко себе своё сраное величие;0
для дебилов, которые ходят в масках и перчатках.;1
пускай тогда скафандры покупают, дебилы:d;1
мразь конченная...в корне поменялось мнение об этом теле;0
дура безмозглая, лучше бы за бабушкой ухаживала;1
дурдом ромашка..нету на сегоднейший день нормальных мужчин ....то гейтр пидораз то урод вот такой ..;0
ты какого хуя лезишь в отношения других и шлеш и говоришь ее мужику выйти отсюда ты швецкая баба?😂 😂 😂;0
ебануэлька,говнозмин ,кукаревич ,наши известные либерасты -прошмандовочники !мировая дырмократическая шобла идиотов-мозгоблудов с весёлым шакальим завыванием приняли их в свою кодлу !;1
а тебе юбку и на панель;0
кто вам тварям крысам дал право распоряжаться народным достоянием суки едино пидоры;0
ты и каретникова идеальной парой будете..один пиздит хз что, вторая тоже😂;1
после подобных речей и действий какие могут быть братские отношения хорошо хоть партнерские бы остались я бы с ним после всего этого срать на одном гектаре не сел просто ублюдок.;0
пидорша, я буду белить фору, пока не перестанешь заниматься хуйней.;1
у власти те кто уподобляется американской системе....пиндосы своим капитализмом стали богаты и тащатся.... только вот что теперь после этого всего стало.?...;0
спившийся.опустившийся алкаш.иной бомж порядочнее и честнее.;0
при всей своей незлобливостии мысль одна - лучше бы ты сдох.тварюга.;0
падла шаркает.охуярить её тысячь на 500.;0
не дети,, а выблюдки,,,, кто их родители,то в клетку к медведям лезут,,,то яйца ради забавы бьют,, из-за таких уродов страдают животные ,,,и все вокруг,,,;1
уёбгений, твой комментарий- от лживых скотопидоров с кошачье -собачьего- едросовского сброда, ограбившего страну и грабящих людей...(fr) :-d :-d 😂 😂;1
у меня молли блядь и тоже в четыре утра.;0
:-d я ржу над дурачками, которые бабло кефиру отправляют, а потом ебутся с 2032;1
очередной сука уебок, да не пойти бы тебе нахуй, обезьяна ты ебанная;1
то что твоя жопа вся в дерьме для нас не новость!;0
кому они всрались эти банедры еще и смотреть на них..ущербные францюватые и недоразвитые;0
лада лох купи ладу лох,почувствуй себя л.....;1
ты петух молотить будеш?да по тебе дурка просто воет;0
0бляяяядь..ну почему в однокласниках один жопы;0
если вы бляди скромнее одиваться будите вас и за шалав держать не будут домогательство блять .;0
только безмозглая тварь этого не видит.;0
что самое интересное фукусиму им тоже пиндосы построили но как то через одно место :-d﻿;0
и всегда найдётся какой-нибудь фидарас который будет лизать опу провителства ..;0
правда урод,,,, жизнь это бумеранг.... свое он получит....;1
успокойся и попробуй ещё раз членораздельно выразить свою мысль на русском языке нищий пиздабол;0
такие вые*ки как этот смирнов, лучшая реклама атеизма);1
ваша страна ...какая у тебя страна хуета ты безродная..?;0
а придумывают всё, грёбаное дегенеративное правительство и вся эта пи.дабратия...;1
автор, ты сам дибилоид или извращенец отстойный?!!!!!;1
с я все могу понять лихие о е на проклятые демократы враги западе пятая колонна стали но почему вы сука миллиардерами а народ бедный и нищий;0
потому что эти долбосенсы херня полная.;0
подыхать будешь,тот же доктор и к тебе приедет.. скажи ему лично,как ты его назвал.. интересно,что он придумает,что бы тебя,херню тупую, спасти..;1
да блядь хотя ты почти и земляк а гандон ты штопаный;0
таких пидарасов и надо так учить, подвозомнили себя крутыми пидарасы ебучие, гореть им из века в век в аду;1
я не видел свою жену пьяной голой... но вот блядей таких много повидал)));0
она идиотка но только не ватная, она чурбанская идиотка, и рожа у нее пепсикольная.;1
я все сказал тебе привет от канала разносчик фейков и всякого гавна колясик-пидорасик!;0
ты главное после каждого написанного в мою сторону комментария не забывай из своего рта хуй высовывать!;0
блять сколько всякие чинуши и их ублюдки дети,все молчат,а тут распизделись.;1
эй ,рогулятина ...чё уже взлетело ?;1
совсем с головой не дружит, дура;1
вот этих пидора _.. в которые спекулируют на больных и инвалидов твари;0
автор сам не далеко от мера уплыл,мэр а не мер тупой дибил.;1
в пизду засунь свою россию!...;0
сдохнешь как и все в надеждах и нищете тварь!...;0
жир трест.да разве могут они с такими харями работать???;0
он просто себе и своим пидорам делает плот, где его плешивого не кто не достанет;1
сейчас и в спортзалах половина полупидоры какие-то )));0
а ты меркельский холоп и что дальше?);0
либеральная нечистота это как раз ты лизоблюд опоголовый со своим со своим хозяином, он сам признался что придерживается либеральных взглядов!;1
пидоры они одним словом,и президент наш тоже пидор;1
какой нахрен вид на жительство,он пид)р визу показывает,чтоб резиденцию испанскую получить надо 3.5 года прожить или недвижимость дорогую купить;1
маразматик какойта пишет фейк еак вы надоели;0
ты дура за собой смотри,хули из подтишка пишиш ебало свое не показываеш,позаблокировала все, или че есть что боятся.;1
далбаеб и все саляру чувствуеш хорошпя плохая тут на отработке пиздец а тнвд фильтра как протянут ✌️﻿✌️﻿✌️﻿;0
ефрем я думал ты мужик чмо;0
похоже ты сам из пиздосранска какогото дятел;0
вот такие дебилы считают себя защитниками народа!;0
дааа,таких хватает,повороты не включают,пидарки!;1
коментировать нечего просто простите за выражение сука,;1
ай молодцы......... страна шлюх и педиков.;0
а что еще делать, если большей частью тут пиздаболы!!;1
когда же в россии все проснутся?или так и будем рабами пидарасов;0
спят а. пенсионеры пашут суки а не.;0
пиздец нет слов...... уроды....;0
сайт для вахтовиков, работяг , а не для поноса бандерлвского.;1
он не забыл, а обнулился 👎 👎 👎 8oi 8oi 8oi крысёныш !;1
я,смотрю, мадам,у вас все русские-быдло и дебилы?;1
а,вы,видимо русофобка и на минуточку христопродавка!;1
а,не пошла бы,ты в задницу!!;1
или потаскуха, а теперь блогершас переделанной рожей и похабная.;1
хорошее фото !скоро долбоебы будут про радугу спорить или уже спорят!;0
положите этого урода и уберите ей по женски чтоб это сука не рожала как свинья.;0
вороне хуй к носу подвели казлу в жопу;0
порю вот такое чмо несет такую галиматью и многие верят.;0
мозги и не выкладывайте таких дебилов в ютюб и т.д.;0
или пол страны тоже ебанутые стали.;0
а чего ебальник закрасили , может быть его еще кто то бы опознал !;1
,+, с какого ху...... растет зелёный?;1
вы лохи ебучие,пешком научитесь ходить,какие нахуй привода у уазе, чайники ебаные;1
ты сука самый основной вор в россии.;0
еблан я замужем тринадцать лет, ущербный ты мой,мне тебя очень жаль,найди себе уже женщину и успакойся😂😂😂;1
вот бляди, мужик обеспечил, она ещё пищит что то, если это ее слова!;1
бреднева..к ебучим хахлам теперь не какой культуры...враги они.;0
росбыдло любит вождя и вождь любит росбыдло!;0
ты про кого все пишешь еблан;0
ну, чтож, ты страшная такая, тебя боятся даже, хулюганы.;1
глухов, мне похуй на тебя, животное ебучее.;1
а вообще иди на хуй, просто не пиши мне, мразь;1
хуйня какая то, картинка с дебилами одна и та же, по 10 раз.;1
не могла найти где тебе гаду написать.;0
такие падлы как ты офицеров в гражданскую вешали и пытали, фашистам служили в отечественную.;1
и ебло у ее тупей не бывает;0
сто процентов твоя правда с 4 утра хуя ищит ,но все ее отвергают а она липнет как гавно в обуви;1
а работники магазинов твари им все аукнется!!;0
ты сам у себя отсоси, потом будешь указывать русским что делать....;1
обидно что этот сайт делает, из общения, в побор денег всяких пидорасов;1
вся эта бандеровская х.. та нужна, чтобы стравить русских с русскими.;1
хотя в семье не без уродов.;0
мусор сдох и хуй на него!!;0
лучше вали блядь на х вам тут не места;0
крашеная мартышка,тебя с мылом умыть,и показать ужас который предстоит увидеть.не суди,да несудима будешь;1
из половины небесной сотни-алкаши, наркоманы и отбросы общества!;1
идиоты ебаные не знают с кого брать....;0
да насрать на этих пидоров, пусть передохнут там все.;1
придурок лег а долбан лечит или думает что лечит;0
о!хуесосина,нарислвался?по хуям соскучился,задрота интернетная?;1
ну отмажут это чмо адвокаты .....как оно дальше жить то собралось ?;0
убогая это ты...иди работай...чучело;0
с воркуты работница онкологии грязная давалка за деньги;0
до каких пор власть ублюдков будет уничтожать свою родину.;0
припиздиваете семья с 5 ребенком будет обходить митинги через 5 улиц.;0
а эти суки пошли и ребенка подставили.;0
шмундыр или как тебя там по мове, заткни своё ебло, похмелись и ложись спать, чмо!!!!!!!!;1
с таким свинным рылом --хряк кастрированый--там давление под 200 сдохнит сразу без врачей чушкарь --!!!;0
дебилы сука совсем свехнулись фанатики религиозные!!;0
она уже заебала всех со своими шпагатами какбудто больше нет.;0
никого пластичней чем волочкова на кол ее и джигурду рядом;0
помоему, тот кто делал ети снимки, гораздо ебанутей этой ангелины!!;1
да блин отчаянный пидарас а мог бы и душу богу отдать на суд;0
а что же ты паскуда не пишешь чтто строятся больницы, заводы, садики, школы?;1
а потом еще и спишет этот долг, а нам какой нибудь налог въебать.;1
слышь ты еблан русский язык и уголовный и упк выучи и не защищай всяких пидоров.;0
с российским вроде ошибка вышла, вроде наши пидары.;1
555 заебатся-это я успел за одно утро;0
малолетние шалавы и родители которым похуй на все;0
какой то хрен с бугра, вставил сюда какую-то картинку с женщиной и какими-то не типовыми словами.;1
поздно хватился дядя,говно отмывать трудно изволяли хорошо.сука сванидзе иже с ним.;1
лично я сейчас за дальневосточную республику,как 1918-1922г,сибирь,алтай,и др.проживут без москалей и пидорцев,а вот они?;1
пусть у себя наведёт коммунизм....а потом к нам лезет ...сука;0
и я не оскорбляю, говорю правду, ты пидарок, в жопу чпок.;1
ваууу какая сексуальная сука просто бомба;0
придурки вы, заберите всех южан коррупционеров, заеба..ли они.;1
бабы брезгуют тобой,что ли?или ты уже не в состоянии стояния😅😅😅?ой бля,сколько же в руссопидорасии дрочеров,сука рашка😆😆😆;1
тот за данного гада.. когда в 90-е бомбили югославию.;0
сейчас все, кто срет на страны, я надеюсь, получает за это деньги.;1
война в россии будет посмотрим тот время кто кого ж*** будет облизывать;0
но все ведь не могут быть проститутками как она...я думаю пусть соглашаются с ней те кто как она...;0
эти твари пусть пиздят своих детей матерей жён.;0
вы что суки святое трогаете это бессмертный полк а не ваша вонючая акция бляди лишь бы спровоцировать;0
а какого хера его слушать все равно наеб.;0
