text;label
нет бы порадоваться за парня,показывает себя достаточно неплохо в одной из лучших лиг мира,зачем вот обязательно всё политизировать?;0
в сысерти остановлено строительство ледового центра, средства на который привлекались в рамках государственно-частного партнерства с угмк.;0
отчасти подтвердило несовершенство проекта возведение подпорной стены для ледового центра, однако и оно остановилось на середине из-за необходимости изменений используемых материалов.;0
экс-подрядчик и действующий застройщик подпорной стены указывают на длительность согласительных процедур в администрации муниципалитета.;0
спасибо, дозвонилась в соцзащиту , сказали сбой программы ,все доначислят;0
пропала еще один источник доходів путинского режима;0
говорят кто спасает собачку , тому бог помогает;0
у меня запрос через7 минут подождете?;0
люда, у меня вот столько вчера получилось из пол порции, указанных в рецепте ирины;0
а я почему то решила, что леонтьева родилась в нашем пригороде.;0
даже музей есть как не в языкове ли..... надо в инете глянуть.;0
тоже самое , собрала вещи на три месяца , позвонила главе горбуновского поселения , он сказал , что девочке чуть больше года ...;0
у меня племянница любит хлеб с маслом посыпанный сахаром,ей 4 года...﻿;0
мой кошелек магнит для денег ,да будет так.аминь.;0
то есть, если вы вдруг, дай бог, доживёте вместе до 102 лет (а эти старики, судя по их внешности, дожили) , то 80 совместных никак не насчитаете?;0
с днем рождения малыш, будь здоровым и счастливым;0
ты будешь сильно разочарована и очень скоро...и кстати, глянь в зеркало.;0
может его и любят, как артиста, а как человек, у многих пал в глазах.... он виноват уже в том, что пьяный сел за руль... а закон для всех должен быть один!;0
работа над данным 8-минутным видеороликом заняла 14 месяцев!;0
или очень нужно набрать классы за чужую работу?;0
как тонко подмечает,а ведь и правда за свою доброту приходится расчитываться.;0
копейки интересно откуда,сумма 4500 в месяц как я прочитала , может кто знает,какие выплаты в месяц,подскажите пожалуйста.;0
а предыдущее отключение, когда закончится (20-26), сегодня 31?;0
она секретутка.ни какая страна, а какие правители и кому они служат и чьи интересы защищают.;0
да, насчёт перца вы погорячились, два килограмма это уж перебор.;0
а растяжку надо делать для себя, а не для показухи;0
зато секс с кем попало особенно в марте.;0
то есть если переезжаешь в другой город освободи квартиру;0
достойно очень, будь здорова и счастлива с девочкой;0
здравствуйте до какого размера идут джинсовки?;0
у меня всё хорошо: работа, квартира, любящий муж, вот только солнца не хватает, а на машине поехать некуда, на общественном транспорте быстрее до работы добираться 😉.;0
это надо под суд кто это егэ придумал .они сами то хоть грамотные .;0
почему их не проверят .убрать этот закон и дать детям нормально учится .;0
друзья мои верные, выручайте в трудном деле!;0
для того чтобы задачу непростую выполнить нужна мне вещь редкая.;0
подскажите, куда можно на плавание отдать?;0
и, если, уж обратились к мастеру, то выполняйте то, что вам сказано.;0
многие сами портят результат работы, а потом виноват мастер!;0
многие пытаются проверить мастера на наличие способностей(таких сразу видно)!;0
некоторые приходят и говорят:а другая ведьма мне не так сказала и прочее!;0
многие приходят к мастеру, но не хотят слышать правду, а хотят услышать то, что они хотят!!!!;0
через себя действительно многое пропускаешь... ко мне обращалась девушка!;0
ей сказала магуя(из серии интернетовской, наверное), что на ней порча и она умрёт через 3 дня!!!;0
привет григорий!на луке катушка с леской,а стрела гарпунного типа присмотрись.😊;0
всё чаще кто то кого то вычеркивает, и подчеркивает другого, спустя маленько, подчеркнутый вычёркивает того, кто его подчеркнул, и теперь вычеркнутый сожалеет, что подчеркнув этого, вычеркнул первого и т.д;0
почему не открывается игра,загружается на 100 процентов,а не открывается уже несколько дней.;0
добрый вечер, красавицы хочу к вам обратиться!;0
у многих замечаю на ножка выпирающие косточки, поэтому хочу предложить эффективный способ их убрать без помощи хирургии... очень подробно что и как расписала у себя❤;0
поздравляю с днём рождения,желаю тебе здоровья счастья успехов.;0
у мужчин и после 40 самый активный возраст!!!;0
интересно по какой такой статье отстранили?;0
моего мужа привезли на скорой 3дня пролежал нечего не делали ,даже капельницу не ставили;0
поэты и барды то зачем в политику ударились??;0
это особенности породы,до года они очень своенравны,а потом человечнее и семнйнее,наверное нет породы,но только если она воспитывается в любви и ласке...;0
здравствуйте да во всех магазинах модный ребёнок;0
за койко-место в сутки, в зависимости от степени благоустройства номера.;0
принимает или нет сейчас посетителей, можно уточнить по номере 2-18-51.;0
приморский край хасанский район пгт зарубино.;0
я смотрю вам очен нравится етот поза;0
тогда классов мы вам наставим в десять раз больше!!;0
начинаете вязать платочной вязкой с того края, где шире, потом сокращаете петли;0
новых уровней нет, жалко но придется удалять игру.мне надо 1091 уровень.;0
старшему сыну мы намекнули,он сказал что как вы решите ,так и будет ,но мне кажется он не очень рад,а вот младший категорически против;0
так же мучались в этом возрасте 🙈....нам тогда помог только респиридон, сейчас хлорпротексен пьём на ночь.;0
а своим, пусть своеобразным, но трудом заробатывают.;0
и вам ни кто не мешает морковкой торговать, выращенной на своём огороде.;0
не обижайтесь, но они молодцы, что сделали себя сами, а не за счёт нас.;0
очень вкусно, готовлю часто, особенно для гостей!!;0
она благополучно одолела еще две конфеты, запила их целым литром зеленого чая, торжественно пообещала себе не прикасаться к сладкому еще лет двадцать и уснула, чрезвычайно довольная неизвестно чем.;0
вероятно, просто собой и жизнью в целом.;0
понятие «злость» имеет много синонимов, и нужно правильно использовать эти синонимы.;0
иначе можно из-за негодования обидеть доброго человека.;0
причем наша мука лучшего качества, вы ее выбирайте;0
добро пожаловать и удачных сезонов за наш любимый клуб;0
боролись вы за справедливость, вот если б вы объединились в борьбе с неправедным режимом и цель была бы достижима, - вас весь народ бы поддержал, а так... какой запал пропал!!!;0
ведь веник тем он и силён - из многих веточек сложён.;0
и возродится наша сила, чтоб уложить врага в могилу!;0
а так... нас с каждым часом меньше на нашей русъкой же земле - всё больше наших братьев меньших, и все они уже в кремле.;0
читаю и улыбаюсь , а ещё приятно перебрать детские вещи своих выросших детей;0
спутника жизни они уже выбрали и на это время совсем не уходит.;0
20:10. опускается олимпийский флаг – восемь спортсменов бережно снимают его и уносят со стадиона.;0
медленно угасает в чаше огонь игр, рождённый в олимпии 19 июля.;0
но огонь, угасший в чаше стадиона, навсегда останется в сердцах всех причастных к олимпийским играм в советском союзе.;0
а на большом табло стадиона начинается показ короткометражного фильма, посвящённого самым ярким мгновениям олимпиады.;0
нужна мне помощь да поддержка дружеская, не хватает в хозяйстве вещи малой для дела важного.;0
потому что нельзя быть красивым таким;0
вы назвали войну лучшим выходом из ситуации .;0
а наши деды в том числе и терпением завоевали победу.;0
да, и, мое мнение, художника надо оценивать по его творчеству, а не политическим убеждениям;0
у нас зарплата небольшая, мы являемся малоимущей семьёй с 2 ребятишками и с ипотекой.;0
на пособия имеет право каждый нуждающийся человек.;0
б причин путин почему лучший россии для президент павел ф;0
куплю 10 кукурузных палочек обмен на склад, амбар, расширение, пилы и топоры;0
поклон мой низкий перед врачами...здоровья им и семейного благопалучия;0
а зелененькие-это ромовая баба, муж их очень любит и зебра, еще не пробовали их.;0
я вам поставила класс и ком, почему не ставите взаимно??;0
и его исполнение песен величайшего нашего любимого, незабываемого муслима магомаева чем то похоже.;0
а отделку для двери делаете внутри квартиры?;0
жители побережья байкала должны жить достойно, а не выживать.;0
осуществляем запись на суточных цыплят бройлер: 29 августа - росс 708 2 сентября - кобб 500 цена 55 руб.заказ принимаем от 10 шт, доставка по городу от 100 штук бесплатно ‼‼ горловка 5 квартал амстор.;0
коростинский алексей иванович и беккель валерий карлович!;0
малина сейчас ведёрко осталось одно 5 литров;0
доброе дело делаете.дай бог и на вашем пути таких сердечных и не безразличных людей.спасибо вам.;0
служил в гсвг с 1978 весна по 1979 осень г фогельзанг хим батальен вч пп 25497 да земы было время;0
путин никого и ничего не боится и если он уйдёт с поста президента ,то ничего не потеряет потеряет россия и всё сразу кто ещё имеет столько терпения работать с таким не благодарным народом как мы;0
тут даже сказать то не знаешь что.каждый день только страшные вести.люди перестали быть людьми.;0
и в севастополе сегодня ооочень жарко и душно, +33 в тени!;0
завтра нам обещают прохождение холодного фронта, дождь, грозу, ветер.;0
хотя в севастополе вряд ли что-то будет такое, в крыму - да!;0
почему пишут такое ,что тут стыдного .это тяжелый труд.а есть не стыдно?;0
чего мучаешься с иголочкой, возьми спицу с зонтика, там ушко есть, подбери длину, заточи, я по 10 сразу сажу на иглу и потом сбрасываю на нить;0
ошибка в слове пионеры)) разделение по слогам неверное, если я не ошибаюсь;0
в твой день рождения муза не дремала: дала тебе упорство, голос и талант.;0
так пусть же в твою честь фанфары прозвучат!;0
о,у меня сённи денёк предстоит плодотворный,я дома занимаюсь в консервном цехе!;0
чистотел самое эффективное и дешевое средство;0
1. во время игры не видно сколько осталось монет, пока не закончется картина.;0
2. почему изчезла помощь поиск с лупой;0
я в этом ничего не понимаю, поэтому суть этой информации тоже не поняла.;0
правильно будет чортковский, тернопольская область.;0
наташенька, огромное спасибо за теплое поздравление;0
где были родители ?почему ребенок один спасал в бане котенка ?;0
фото платьев в вашем альбоме взяты с другого сайта, с сайта женской одежды из беларуси.;0
нужно мерить,если хотите,я дам адрес,приходите;0
обсолютная правда, когда курск топил, три недели никто его не видел.;0
пусть видео посмотрит, память освежит.;0
продам молокоотсос авент электронный, цена 2000;0
говорят питомцы на хозяина похожи,возможно вы правы;0
этих ребят мы знаем, а кто эта красивая девушка?;0
слива забрала на себя весь вкус маринада, а помидоры получились пресные.;0
в наше время актуально с экологической точки зрения.... главное не лениться.;0
надюша, сестрёнка здоровья счастья и благополучия!!!!;0
с днем рождения тебя девочка, всего тебе самого наилучшего в жизни.;0
кто говорит, тому и будет хорошо, хотя им и сейчас неплохо .;0
человек должен в любой ситуации оставаться человеком, в автобусе наверно у кого то была в запасе маска, можно было дать пассажиру...;0
новая полянка или что то связанное с морем и небом.;0
к сожалению, подрядчик не очень отзывчив, поэтому специалистам и руководителю ужкх приходится применять меры административного воздействия.;0
господи, он хоть бы бога не гневил, церковь не трогал.;0
самое важное для тебя — это твоя семья.;0
ты заботишься о всех и вся, живешь для других и готова приносить себя в жертву бессчетное количество раз, лишь бы другим было хорошо.;0
ты несешь своим близким добро и радость, тебя любят, и это делает тебя счастливой.;0
всем привет ищу знакомство прост на карантине ппц как скучно а пообщаться не с кем пишите в лс;0
к мясникову надо обратиться, чтобы связался с нашим губернатором и популярно объяснил ему, что такое здоровый образ жизни.;0
разве убийца детей может быть переговорщиком ?;0
так писали же, что когда закупили эти аппараты ивл, что они не те, только деньги зря потратили!;0
о мальте не знаю.... но об испании и англии да;0
прикольная и сколько она стоит такая банька?;0
почитай ...что такое хорошо и что такое плохо?!;0
ситуация с коронавирусом в кировской области на сегодня;0
братское сердце,скорблю вместе с тобой!!;0
как вариант попробуйте держать зерноядных птиц, которые живут в вашей местности.;0
это вышка,на которой меня поднимали тысячи раз.;0
молодец дед👍сейчас не каждый молодой так может 👍;0
делать ближе к ночи и что бы ни кого рядом не было.;0
чтобы пить или колоть антибиотики, конечно, нужно бы сначала убедиться, что это именно плеврит.;0
проблемы с сердцем тоже могут быть причиной кашля.;0
классная актриса обаятельная женщина супер;0
группа по интересам и присылать материал можно всем..;0
мишустин что ты творишь народ скоро попрет на вас войной;0
с днем рождения ,малыш!здоровья тебе и счастья в жизни!;0
как сказал один невролог=остеохондроз неизлечим ,он навсегда!;0
но хороший доктор правильным лечением поможет избегать серьёзные болевые ситуации...🤗в своих болячках виновата я сама🙈;0
нужна мне помощь да поддержка дружеская, не хватает в хозяйстве вещи малой для дела важного.;0
принемаю заявки на цветочный мед, (светлый), 1литр 400 руб;0
хочу купить флаг сколько будет стоить.;0
это реальная фотка, сами сфоткали из окна;0
а где описание твоих волшебных помидор одна пустая кастрюля да помидоры в банке;0
там где время отправления есть значок-карандаш-можно делать исправления.;0
сейчас патриоты покупают недвижимость и гражданство за кордоном, живут и зарабатывают в россии.;0
были белочки,а в конечном результате-картинка ,как у бека.;0
каунас похорошел, очень лайсвес аллея;0
когда твоя страна ни чего не решает, а ты ни ничего не решаешь в своей стране, то можешь ни кого не бояться даже если ты и президент этой страны..ты никому на ненужен.;0
согласны светлана духи качество делали на совесть и аромат запомниться на всю жизнь 😉🌺;0
только год назад познакомилась с турецкими сериалами, больше ничего смотреть не хочу , турецкие, только турецкие!!!;0
только не многие разумеют что же есть мудрость божия,и многие путают мудрость человеческую( лесть), с мудростью от бога.отсюда и неразумение многих, слова божия.;0
"ибо нужно иметь мудрость,знание,и разум божии; святого духа,чтобы разуметь слова мудрецов и загадки их.";0
иисус христос знал что в человеке,потому не вверял себя никому.;0
почему иисус христос не вверял себя никому?;0
"в каждом три духа нечистых,духа заблуждения; неразумия,глупости,лжи.";0
"до тех пор,пока на человека не изольется дух свыше,святой дух; мудрость,знание,и разум божии.";0
