text;label
я сегодня проезжала по рабочей и между домами снитенко и гомолысовой магазином ( на пустыре) бежала кошка похожего окраса.;0
может, я и ошиблась, но необычный окрас бросился в глаза.;0
зачем придумывать очередной налог на воздух, если можно обьявить инсульт и грипп- пандемией!;0
ретро дежавю ... сложно понять чужое сердце , лиш ощутить музыкой видимо;0
2 августа поздно вечером нашли вот такую потеряшку в районе высоток на победе.;0
девочка явно домашняя, в новом ошейнике.;0
а еще на стоянке никто не проверяет безопасность детей.;0
возле порта на тарзанке стоит человек и смотрит за детьми, а на стоянке прыгает девочка, а вокруг никого.;0
это просто дэлика зубилосовсем немного переделано кузово.;0
вы живёте в россии, не оставляйте российских детей без вашей заботы.;0
я на нем за 21 день марафона скинула 5кг и обьемы ушли по 8см.;0
а потом я чего то расслабилась в принципе как всегда и все.;0
пиши сразу путину раз такая смелая;0
пока хвалиться нечем , не очень хочется затевать ремонт в зале и в коридоре .;0
для вас ,я возьму на себя труд судить о вас ,по-моему большое открытие быть человеком￼ !;0
как же здорово осознавать то, что людей поддерживают, помогают, стимулируют! );0
моя мама доживала со мной и когда заболела, я ухаживала за ней.;0
очень правильные и верные слова - сказаны.;0
с праздником дорогие, чистого неба над головой, мира на всей земле.;0
интиресно как это - вода чистая но не из под крана, что то не понять;0
а про этого извините но реально ломать мозг над этим людям думаю нестоит.;0
про данный пост забудут через некоторое время, да и как про игру.;0
и ездили на борту грузовика без всяких подписей и инструктажей.;0
ты минут пятнадцать назад смотрела сис приходил;0
очень жаль таких детишек,которые воспитываются с неадекватно- психическими отклонениями!;0
на автобанах только толщина подушки перед основным полотном больше метра, неважно где, германия, франция, чехия, венгрия и т.д.;0
выгодней им дать земельный участок и брать за него налоги😂;0
все против народа.. учить историю надо фашистские отряды и полицаи были утинскиештурмовые отряды времен 1933 года как в германии;0
а мне зять подарил э/ простыню на дачу, теперь радуюсь каждую прохладную ночь, дивлюсь себе-зачем насморк заводила, когда есть такое чудо!;0
можно и в жару, попали в самое пекло, зоопарк в дендропарке находится, все в соснах, очень рекомендую));0
убери деньги изо всего что считаешь вечным, тот тоже исчезнет но вера никогда;0
некоторым, очень трудно видеть красоту природы да, правда это чудо природы;0
я прошу чтобы все последствия прошлых и нынешних ошибок и недоразумений рассеялись да будет так !;0
если есть возможность возьмите пожалуйста у меня 3 кошки и 4 котенок ,вам добро вернётся;0
ладно нам долго лететь.. - ааа,-отвечает,- зато вас первыми откопают...;0
здравствуйте, можно узнать цену курочек?;0
так он может терять свои позиции еще лет 100, а то и 500 и ни на шаг не сдвинулся.;0
а медиков вообще не за что - приехать к больному, поставить диагноз орз, не сделав тест, и бросить на выживаемость!;0
это я только тему коронки затронула, не говоря об остальном!;0
кот само спойствие и пофигизм, а собачка боится??;0
а ты не помнишь как русских гнали из всех союзных республик, а сколько вырезали в чечне, не в курсе или тебе кавказцы нравятся горячие парни, так поверь русские есть гораздо погорячее;0
такой вещи простой в хозяйстве не оказалось!;0
у меня тоже так накрылся,я его ликвидировала,буду новый сажать.;0
как россия, семимильными шагами, путями и созиданиями.;0
не было бы прогресса вы бы до сих пор на полях урожай в ручную собирали бы.;0
вы сами готовы на поле урожай собирать или очищать от сорняков поля в любую погоду?;0
в новополоцке отметили 90-летие вдв и открыли бюст-памятник герою советского союза василию маргелову;0
это было бы многим удобно, так что не вижу в этом какого то кошмара;0
мы тоже были в хорватии, на границе паспорта регистрировали и туда и обратно.;0
из за этого немного дольше едешь, чем обычно.;0
странно вы пишете - хочется верить, что он достойной актер....если он вам нравится, как актер, то нравится...почему хочется верить, еще и в достойного.;0
ну а его личная жизнь, как и всех, ни вас, ни кого вообще не касается;0
святый пророче божий илья,моли бога о нас грешных!!;0
молодец что сумел найти силы воспитывать дочь а проблема с ногами это мелочь главное это любовь;0
только помню мы и сейчас дружим хотя прошло более 40 лет наш 10в и сейчас иногда собирается смеемся друг.;0
,над другом какие были и какие есть школьные годы чудесные а подружка с которой я сидела за партой была ещё у меня на свадьбе.;0
ирина спасибо большое за поддержку и добрые слова 🌸💋🌼;0
очень вкусный напиток 🥤 советую всем;0
очень красиво и действительно раскошо,уютно.;0
как говорил милославский- храните деньги в сбербанке- но нужно читать между строк- храните в долларах!;0
байер-рейнджерс 2:2 севилья-рома 2:1 базель-айнтрахт ф 1:0 вулверхэмптон-олимпиакос 3:1 ман сити-реал м 3:2 ювентус-лион 3:0 бавария-челси 1:1 барселона-наполи 2:0;0
вышлю почтой только переведите деньги.;0
мальчику хоть какие-то проблемы в жизни , даже элементарные проблемы со здоровьем и все сразу изменится;0
крепкого тебе здоровье и твоим малышам.;0
обнищание крестьянских масс, это конечно не социальная проблема!;0
мне раньше из москвы привозили а в этом году облом с вирусом.;0
что то ни какого азарта в игре,напоминает плей офф игры с сибирью;0
мне очень не нравится ограничения по открытию ракушек.;0
у меня теперь выжидательная тактика: открываю ракушки только там, где уже открыты 5 и более.;0
ну хоть чуть -чуть .что ж так все переживают ?;0
женщину в любовь оденьте выглядит красиво она в ней;0
можно было не пугать ребёнка пусть кушает;0
делать нечего, хлеб у волочковой отнимает!хотя, у той, теперь, другой хлеб- скандалы!😄;0
какой % кэшбека при оплате через телефое?;0
а вот с местными людьми общались так никто и в глаза гумпомощь из россии не видели.говорят эта гуманитарка в магазинах на прилавках.. по магазинам походили .;0
приглашаю в союз кот бегемот постоянного игрока.;0
рейтинг союза 397. писать в личку;0
я решила борщ сварить и пельмени отварим кто захочет;0
о боже мой... о боже мой... не могу сдержать своих эмоций... я начинаю не ненавидеть людей... что же вы творите?!;0
каждому военному по мастерку в руки пусть строят жилые дома для людей переплавить танки на велосипеды,стиральные машины,детские коляски и т.д.;0
вот тогда россия начнёт цвести и пахнуть;0
это был великий человек, не то что эти дешёвые правители – предатели нашей страны;0
дамы сейчас действуют акции 1ая- ноги полностью + глубокое бикини + подмышечные впадины бесплатно 2ая- каждое воскресенье скидка 20%;0
у каждого свои доходы и слово не дорогой для дачника- пенсионера, весьма важно;0
с днём рождения тебя 💋💋💋🤗🤗🤗 здоровья счастья благополучия и береги себя , хорошо 😘😘😘🌹🌹🌹🌹🌹🌹🌹;0
ворачиваются в прошлое, а зачем ведь это пройденый этап.;0
я поздравляю всех с днём вмф и хочу отметить слаженную работу специалистов кашарского рдк в подготовке к интернет мероприятиям!;0
на самом деле этот творческий труд в интернете очень кропотлив и ответственен!;0
ваши видео версии программ интересны и легки для восприятия!;0
а мы, посетители группы, ждем новых публикаций!;0
сначала благополучно все разрушили,а теперь взялись строить.;0
он поднимался все выше и выше, пока совсем не скрылся из виду.;0
всем было грустно...утром мишу нашли целого и невредимого на воробьевых горах, после чего его отвезли на склад олимпийского комитета.;0
никому не нужный миша пылился на складе, и про него вспомнили только за рубежом.одна немецкая коммерческая фирма предложила выкупить мишу за крупную сумму денег.;0
а мишу на складе съели крысы и он остался только в воспоминаниях людей.;0
очень жаль, что ему не нашлось место где-нибудь в музее или на выставке.;0
плюшевый мишка, который вызвал столько положительных эмоций у людей, был достоин этого.;0
малышу 55 лет если что.малыш жил ещё при брежневе и может сравнивать разные эпохи.;0
ничто в мире не стоит слёз собаки!!!;0
самый красивый город в беларуси,люблю свой город♥♥♥;0
для джонса, главное чтобы тайсон не попал по нему, а то будет плохо;0
нежная чешуя на солнце быстро загорает, пока над водой летает.;0
да сплошь и рядом оставляют детей одних, и гуляют одни, и в магазин одних посылают, и мусор выносить, и не только девятилетних, но и меньше возрастом.;0
перед чм по футболу убрали этот ужас с улиц виза и вот опять-оранжевые и белые на колёсах ржавые ужасные стоят как и прежде!!;0
как и рекламные щиты-та же история, сперва пилим, потом снова ставим...;0
а народ отблагодарит награжденных немного позднее.;0
мед будет примерно 10—13 августа, хорошо, позвоним вам обязательно;0
многие лета дари добро и любовь!;0
?существует мнение ,счастливый человек не обижает других.;0
самая лучшая картошка на домашнем сале и только на чугунной сковородке!!!!;0
при брежневе леониде ильиче мы жили хорошо и жили хорошо порядок был во всем и законы соблюдались время это золотое не вернуть очень жаль а как хорошо жилось;0
собачку ещё не отдали, если не отдали можно номер телефона;0
народ,я люблю россию и не хочу,что бы вмешивались другие страны в нашу политику.;0
детский транспорт нашёлся, его забрали в участковый пункт полиции, завтра вернут!😊😊😊;0
будет тем кто ещё не получал, а кто получал уже не чего не будет;0
точно , коса на камень нашла, в видео жители рассказывают , что сами сажали лес , но это на самом деле смешно.;0
конечно, не хочется чтобы кто-то из молодежи вступил с тобой в дискуссию.;0
а ты просто будешь удивлен последствиям безобидной критики.;0
нужна мне помощь да поддержка дружеская, не хватает в хозяйстве вещи малой для дела важного.;0
у меня сестра троюродная работает в больнице в красноярске санитарной, совмещая обязанности медсестры.;0
в отделении уже почти весь персонал на больничном, но короновируса не ставят им.;0
по факту большая часть персонала на больничном.;0
пару дней назад эта участь постигла и её, она заболела.;0
ни на какие кт и прочие анализы в её больнице её не отправили.;0
больничный не выдают сейчас, он электронный, и она даже не знает что там за диагноз ей написали.;0
какая красота, мы в прошлом году хорошо там отдохнули!!!;0
если никогда такого не было, то почему опять?;0
советский союз - это самое лучшее, что было в нашей истории !;0
и как всегда, все смотрят и снимают.... никто не заступился...;0
образование все страны дают, а высшее образование не ссср мне дал.;0
прямо точно про моего бывшего мужа!;0
значит есть двух клавишный выключатель;0
полно таких жалельщиков и считают, что великое доброе дело делают - с улицы забрали, а то, что жизнь на улице продолжается невдомек.;0
- так дорого же ж) и при этом поза: я спасаю животных;0
да разве можно тебя забыть доцентты наш родной!;0
очень круто,хорошо что есть такие люди,которые пишут такие прекрасные вещи...;0
она, когда идёт не боится сломаться пополом?;0
москвичи вас все ненавидят.а кто нас примет в москве.заболел и подыхай.;0
смотришь и глаз не оторвать.это умнейшие животные.;0
раньше врачи действительно лечили ,боролись за каждого больного ,а сейчас оказывают помощь !;0
во время пандемии люди умирали от рака , инфарктов ,почему их не лечили ?;0
она просто пытается заинтересовать людей, чтобы потом на них заработать.;0
неужели есть ещё такие наивные, которые это не видят?;0
восхищена вашей работой, кропотливым трудом!;0
а на самом деле цвет берета - не самое главное.;0
важно, чтобы человек в любой ситуации оставался человеком;0
так могут и вообще фото выложить, вы что думаете она сама?;0
а теперешнее поколение , даже не знает что это такое???;0
здравствуйте, если рейс будет отменен вам поступит об этом оповещение а почту;0
скончались с короновирусом от другого заболевания, а не от короновируса.;0
владик сынок это тебе люблю тоскую без тебя мой ангел небесный;0
чтобы все испортить..и не хватит целой вечности.;0
прежде чем что-то сказать или что-то сделать...берегите друг друга люди!!;0
!боль потери не лечит хмель..мы художники наших судеб..мы и кисти.;0
и --акварель..относитесь к любви как к кладу..чтоб потом не рыдать ей вслед...без любви ничего не надо..без любви ничего и нет!!;0
ты очень классная девочка, удачи тебе красавица;0
кроме чехов я люблю только альпов в таком окрасе!!;0
я разделяю вами с вашу печаль и скорблю вместе вами с;0
знаю очень многих которые из не богатых,бедных семей которые добились многого.и так де тех кто из семей с достатком,которые не добились ничего.;0
а я вместо алычи ложу маленький помидорчик чери.;0
это действительно были лучшие годы жизни;0
дааааа все хорошо базарят а как дело доходит до наказания то все всторону и тишина;0
а между предложением и делом может пройти много лет.;0
давно пора, опустить зарплаты депутатов, сенаторов и т.п.;0
тогда в депутаты пойдут те, кто, действительно, заботится о россии и россиянах, а не те, кто рвется к кормушке, чтобы набить свой собственный карман!;0
как хорошо вы написали, прочитала как про своего деда шляпина василия, правда после войны 22 года прожил, но ушёл на войну 18 летним парнем, а вернулся с медалями и осколком.;0
осенью 1979 года меня после учебки направили служить на камчатку на скр резкий.;0
товарищ мартиросян, в то время - кап-три, работал там командиром корабля.;0
раз согласились работать от безвыходности за такую зарплату, зачем тогда жаловатся?;0
у вас есть выбор, или работать или не работать за такие деньги.;0
уменя тоже сын с разными глазами один карий другой голубой и он для нас все равно красавиц наш и ваша девочка очень красивая дай бог ей здоровья;0
скажите пожалуйста а где этот город находится?;0
достаточно посмотреть на флаг армии генерала власова.;0
я использовала дюфалак, нам очень помогло, его совсем немного;0
добрый день,можно приобрести рабочую программу для 2-3 лет;0
если это правда,я преклоняюсь перед такими людьми,дай бог вам здоровья и ребёночек,вы умница.;0
доця с зятем и мальчишки, а внучка со мной дома.;0
мы бы тоже поехали, да муж на вахте, а у меня хозяйство.;0
ты даже не знаешь когда масло пальмовое стали завозить .;0
оплатила 76руб.21:42 с карты 1413 людмила алекс.к.передать в прохладный.;0
10 лет карасю... конечно стал членом семьи... как кот или собака...;0
действительно,мы весь год об иссык-куле мечтали и вдруг такое...:(;0
поднятие пенсионного возраста.развал экономики.публикация это провокация и ложь.;0
молодцы честь и хвала вам дай вам бог здоровья и вашему ребеночку🌼🌼🌼❤;0
замечательно,все вы довольствуетесь,но дети без отцов растут;0
